{
  "molssi_bse_schema": {
    "schema_type": "metadata",
    "schema_version": "0.1"
  },
  "names": [
    "TZVP-MOLOPT-UZH-PBE0-GTH-q11",
    "TZVP-MOLOPT-PBE0-GTH-q11",
    "TZVP-MOLOPT-HYB-GTH-q11"
  ],
  "tags": [],
  "family": "molopt_uzh",
  "description": "UZH protocol GTH orbital basis (TZVP-MOLOPT-PBE0-GTH-q11)",
  "role": "orbital",
  "auxiliaries": {}
}