{
  "molssi_bse_schema": {
    "schema_type": "metadata",
    "schema_version": "0.1"
  },
  "names": [
    "cc-pVTZ-F12"
  ],
  "tags": [],
  "family": "dunning_f12",
  "description": "VTZ for explicitly correlated F12 variants of wavefunction methods",
  "role": "orbital",
  "auxiliaries": {
    "optri": "cc-pvtz-f12-optri"
  }
}