{
    "molssi_bse_schema": {
        "schema_type": "metadata",
        "schema_version": "0.1"
    },
    "names": [
        "6-31G*",
        "6-31G(d)"
    ],
    "tags": [],
    "family": "pople",
    "description": "6-31G + polarization on heavy atoms",
    "role": "orbital",
    "auxiliaries": {}
}
