{
  "molssi_bse_schema": {
    "schema_type": "metadata",
    "schema_version": "0.1"
  },
  "names": [
    "QZVPP-MOLOPT-UZH-PBE-GTH-q11",
    "QZVPP-MOLOPT-PBE-GTH-q11",
    "QZVPP-MOLOPT-GGA-GTH-q11"
  ],
  "tags": [],
  "family": "molopt_uzh",
  "description": "UZH protocol GTH orbital basis (QZVPP-MOLOPT-PBE-GTH-q11)",
  "role": "orbital",
  "auxiliaries": {}
}