{
  "molssi_bse_schema": {
    "schema_type": "metadata",
    "schema_version": "0.1"
  },
  "names": [
    "DZVP-MOLOPT-UZH-PBE0-GTH-q5",
    "DZVP-MOLOPT-PBE0-GTH-q5",
    "DZVP-MOLOPT-HYB-GTH-q5"
  ],
  "tags": [],
  "family": "molopt_uzh",
  "description": "UZH protocol GTH orbital basis (DZVP-MOLOPT-PBE0-GTH-q5)",
  "role": "orbital",
  "auxiliaries": {}
}