{
  "molssi_bse_schema": {
    "schema_type": "metadata",
    "schema_version": "0.1"
  },
  "names": [
    "DZVP-MOLOPT-UZH-PBE-GTH-q14",
    "DZVP-MOLOPT-PBE-GTH-q14",
    "DZVP-MOLOPT-GGA-GTH-q14"
  ],
  "tags": [],
  "family": "molopt_uzh",
  "description": "UZH protocol GTH orbital basis (DZVP-MOLOPT-PBE-GTH-q14)",
  "role": "orbital",
  "auxiliaries": {}
}