{
  "molssi_bse_schema": {
    "schema_type": "metadata",
    "schema_version": "0.1"
  },
  "names": [
    "TZVP-MOLOPT-UZH-PBE-GTH-q8",
    "TZVP-MOLOPT-PBE-GTH-q8",
    "TZVP-MOLOPT-GGA-GTH-q8"
  ],
  "tags": [],
  "family": "molopt_uzh",
  "description": "UZH protocol GTH orbital basis (TZVP-MOLOPT-PBE-GTH-q8)",
  "role": "orbital",
  "auxiliaries": {}
}