{
  "molssi_bse_schema": {
    "schema_type": "metadata",
    "schema_version": "0.1"
  },
  "names": [
    "TZVPP-MOLOPT-UZH-PBE-GTH-q17",
    "TZVPP-MOLOPT-PBE-GTH-q17",
    "TZVPP-MOLOPT-GGA-GTH-q17"
  ],
  "tags": [],
  "family": "molopt_uzh",
  "description": "UZH protocol GTH orbital basis (TZVPP-MOLOPT-PBE-GTH-q17)",
  "role": "orbital",
  "auxiliaries": {}
}