{
  "molssi_bse_schema": {
    "schema_type": "metadata",
    "schema_version": "0.1"
  },
  "names": [
    "TZV2P-MOLOPT-UZH-SCAN-GTH-q15",
    "TZV2P-MOLOPT-SCAN-GTH-q15",
    "TZV2P-MOLOPT-MGGA-GTH-q15"
  ],
  "tags": [],
  "family": "molopt_uzh",
  "description": "UZH protocol GTH orbital basis (TZV2P-MOLOPT-SCAN-GTH-q15)",
  "role": "orbital",
  "auxiliaries": {}
}