{
  "molssi_bse_schema": {
    "schema_type": "metadata",
    "schema_version": "0.1"
  },
  "names": [
    "SVP-MOLOPT-UZH-PBE-GTH-q21",
    "SVP-MOLOPT-PBE-GTH-q21",
    "SVP-MOLOPT-GGA-GTH-q21"
  ],
  "tags": [],
  "family": "molopt_uzh",
  "description": "UZH protocol GTH orbital basis (SVP-MOLOPT-PBE-GTH-q21)",
  "role": "orbital",
  "auxiliaries": {}
}