{
  "molssi_bse_schema": {
    "schema_type": "metadata",
    "schema_version": "0.1"
  },
  "names": [
    "aug-cc-pwCVTZ-PP"
  ],
  "tags": [],
  "family": "dunning_pp",
  "description": "aug-cc-pwCVTZ-PP",
  "role": "orbital",
  "auxiliaries": {
    "rifit": "aug-cc-pwcvtz-pp-rifit",
    "optri": "aug-cc-pwcvtz-pp-optri"
  }
}