{
  "molssi_bse_schema": {
    "schema_type": "metadata",
    "schema_version": "0.1"
  },
  "names": [
    "TZV2P-MOLOPT-UZH-PBE-GTH-q10",
    "TZV2P-MOLOPT-PBE-GTH-q10",
    "TZV2P-MOLOPT-GGA-GTH-q10"
  ],
  "tags": [],
  "family": "molopt_uzh",
  "description": "UZH protocol GTH orbital basis (TZV2P-MOLOPT-PBE-GTH-q10)",
  "role": "orbital",
  "auxiliaries": {}
}